{"schema_version":"circuit-weaver-electrical-benchmark/v1","fixture_id":"manufacturing-resolved-footprint","domain":"manufacturing","polarity":"positive","authoring_source":"generator_authored","provenance":{"source_type":"hand-authored-benchmark","source_ref":"benchmarks/electrical/positive/manufacturing/design.json","license":"CC0-1.0"},"expected_findings":[],"expected_absent_rule_ids":["CW-MANUFACTURING-001"]}
