{"schema_version":"circuit-weaver-electrical-benchmark/v1","fixture_id":"usb-c-sink-dual-cc","domain":"usb","polarity":"positive","authoring_source":"generator_authored","provenance":{"source_type":"hand-authored-benchmark","source_ref":"benchmarks/electrical/positive/usb/design.json","license":"CC0-1.0"},"expected_findings":[],"expected_absent_rule_ids":["CW-USB-001"]}
