{"schema_version":"circuit-weaver-electrical-benchmark/v1","fixture_id":"identity-valid-two-source","domain":"identity","polarity":"positive","authoring_source":"independent_reference","provenance":{"source_type":"hand-authored-adversarial-control","source_ref":"T247 independent manufacturer plus distributor review","license":"CC0-1.0"},"expected_findings":[],"expected_absent_rule_ids":["CW-ID-001","CW-ID-002","CW-ID-003","CW-ID-004"]}
