{"schema_version":"circuit-weaver-electrical-benchmark/v1","fixture_id":"clock-matched-load","domain":"clock","polarity":"positive","authoring_source":"generator_authored","provenance":{"source_type":"hand-authored-benchmark","source_ref":"benchmarks/electrical/positive/clock/design.json","license":"CC0-1.0"},"expected_findings":[],"expected_absent_rule_ids":["CW-CLOCK-001"]}
