{"schema_version":"circuit-weaver-electrical-benchmark/v1","fixture_id":"analog-rc-consistent-cutoff","domain":"analog","polarity":"positive","authoring_source":"generator_authored","provenance":{"source_type":"hand-authored-benchmark","source_ref":"benchmarks/electrical/positive/analog/design.json","license":"CC0-1.0"},"expected_findings":[],"expected_absent_rule_ids":["CW-ANALOG-001"]}
